{
  "formatVersion": "legacai-vault/1",
  "id": "vault_example-family",
  "title": "Example family vault",
  "scope": "family",
  "horizon": 100,
  "owners": ["person_alex"],
  "guardians": ["person_sam", "person_robin", "person_jo"],
  "guardianQuorum": 2,
  "executor": "person_sam",
  "createdAt": "2026-10-10T09:00:00Z",
  "primer": "README.md"
}
